{
  "tool": "ShipVitals",
  "version": "1.0.0-beta.1",
  "generated_at": "2026-06-23T02:48:57Z",
  "project": "<benchmark-workspace>\\11ty-eleventy-base-blog",
  "mode": "quick",
  "config_exists": true,
  "product_type": "landing_content_site",
  "product_promise_present": true,
  "commands_detected": [
    "node -e \"const fs=require('fs'); const pkg=JSON.parse(fs.readFileSync('package.json','utf8')); if(!pkg.scripts || !fs.existsSync('eleventy.config.js') || !fs.existsSync('content')) process.exit(1)\""
  ],
  "command_results": [
    {
      "cmd": "node -e \"const fs=require('fs'); const pkg=JSON.parse(fs.readFileSync('package.json','utf8')); if(!pkg.scripts || !fs.existsSync('eleventy.config.js') || !fs.existsSync('content')) process.exit(1)\"",
      "exit_code": 0,
      "seconds": 0.11,
      "stdout": "",
      "stderr": ""
    }
  ],
  "secret_candidates": [],
  "blocking_secret_candidates": [],
  "fake_completion_candidates": [
    {
      "file": "content\\feed\\pretty-atom-feed.xsl",
      "line": 24,
      "pattern": "placeholder"
    }
  ],
  "blocking_fake_completion_candidates": [],
  "proof": {
    "runtime": [],
    "visual": [],
    "ci": [],
    "independent_review": []
  },
  "rejected_proof": {
    "runtime": [],
    "visual": [],
    "ci": [],
    "independent_review": []
  },
  "rejected_proof_details": {
    "runtime": [],
    "visual": [],
    "ci": [],
    "independent_review": []
  },
  "scan_stats": {
    "secret_priority_count": 0,
    "fake_priority_count": 0
  },
  "evidence_levels": [
    "L1_STATIC",
    "L2_DETERMINISTIC"
  ],
  "score": 74,
  "score_caps": [
    {
      "max_score": 89,
      "reason": "Runtime proof missing for critical flows."
    },
    {
      "max_score": 74,
      "reason": "UI project missing visual proof."
    },
    {
      "max_score": 89,
      "reason": "High-stakes release missing independent review."
    }
  ],
  "p0": [],
  "p1": [],
  "verdict": "ALMOST READY",
  "not_verified": [
    "runtime proof",
    "visual proof",
    "independent review"
  ]
}