{
  "tool": "ShipVitals",
  "version": "1.0.0-beta.1",
  "generated_at": "2026-06-23T02:49:00Z",
  "project": "<benchmark-workspace>\\mozilla-webextension-polyfill",
  "mode": "quick",
  "config_exists": true,
  "product_type": "browser_extension_library",
  "product_promise_present": true,
  "commands_detected": [
    "node -e \"const fs=require('fs'); const pkg=JSON.parse(fs.readFileSync('package.json','utf8')); if(!pkg.name || !fs.existsSync('src/browser-polyfill.js') || !fs.existsSync('api-metadata.json')) process.exit(1)\""
  ],
  "command_results": [
    {
      "cmd": "node -e \"const fs=require('fs'); const pkg=JSON.parse(fs.readFileSync('package.json','utf8')); if(!pkg.name || !fs.existsSync('src/browser-polyfill.js') || !fs.existsSync('api-metadata.json')) process.exit(1)\"",
      "exit_code": 0,
      "seconds": 0.19,
      "stdout": "",
      "stderr": ""
    }
  ],
  "secret_candidates": [],
  "blocking_secret_candidates": [],
  "fake_completion_candidates": [
    {
      "file": "test\\setup.js",
      "line": 29,
      "pattern": "\\bTODO\\b"
    },
    {
      "file": "test\\integration\\setup.js",
      "line": 193,
      "pattern": "\\.skip\\("
    },
    {
      "file": "test\\integration\\setup.js",
      "line": 196,
      "pattern": "\\.skip\\("
    }
  ],
  "blocking_fake_completion_candidates": [],
  "proof": {
    "runtime": [],
    "visual": [],
    "ci": [],
    "independent_review": []
  },
  "rejected_proof": {
    "runtime": [],
    "visual": [],
    "ci": [],
    "independent_review": []
  },
  "rejected_proof_details": {
    "runtime": [],
    "visual": [],
    "ci": [],
    "independent_review": []
  },
  "scan_stats": {
    "secret_priority_count": 0,
    "fake_priority_count": 0
  },
  "evidence_levels": [
    "L1_STATIC",
    "L2_DETERMINISTIC"
  ],
  "score": 74,
  "score_caps": [
    {
      "max_score": 89,
      "reason": "Runtime proof missing for critical flows."
    },
    {
      "max_score": 74,
      "reason": "UI project missing visual proof."
    },
    {
      "max_score": 89,
      "reason": "High-stakes release missing independent review."
    }
  ],
  "p0": [],
  "p1": [],
  "verdict": "ALMOST READY",
  "not_verified": [
    "runtime proof",
    "visual proof",
    "independent review"
  ]
}