{
  "tool": "ShipVitals",
  "version": "1.0.0-beta.1",
  "generated_at": "2026-06-23T02:48:45Z",
  "project": "<benchmark-workspace>\\nodeca-js-yaml",
  "mode": "quick",
  "config_exists": true,
  "product_type": "node_library",
  "product_promise_present": true,
  "commands_detected": [
    "node --check bin/js-yaml.mjs"
  ],
  "command_results": [
    {
      "cmd": "node --check bin/js-yaml.mjs",
      "exit_code": 0,
      "seconds": 0.13,
      "stdout": "",
      "stderr": ""
    }
  ],
  "secret_candidates": [],
  "blocking_secret_candidates": [],
  "fake_completion_candidates": [
    {
      "file": "test\\core\\dump-fuzzy.test.mjs",
      "line": 35,
      "pattern": "\\.skip\\("
    }
  ],
  "blocking_fake_completion_candidates": [],
  "proof": {
    "runtime": [],
    "visual": [],
    "ci": [],
    "independent_review": []
  },
  "rejected_proof": {
    "runtime": [],
    "visual": [],
    "ci": [],
    "independent_review": []
  },
  "rejected_proof_details": {
    "runtime": [],
    "visual": [],
    "ci": [],
    "independent_review": []
  },
  "scan_stats": {
    "secret_priority_count": 0,
    "fake_priority_count": 0
  },
  "evidence_levels": [
    "L1_STATIC",
    "L2_DETERMINISTIC"
  ],
  "score": 89,
  "score_caps": [
    {
      "max_score": 89,
      "reason": "Runtime proof missing for critical flows."
    },
    {
      "max_score": 89,
      "reason": "High-stakes release missing independent review."
    }
  ],
  "p0": [],
  "p1": [],
  "verdict": "ALMOST READY",
  "not_verified": [
    "runtime proof",
    "independent review"
  ]
}