{
  "tool": "ShipVitals",
  "version": "1.0.0-beta.1",
  "generated_at": "2026-06-23T02:48:58Z",
  "project": "<benchmark-workspace>\\nextauthjs-next-auth-example",
  "mode": "quick",
  "config_exists": true,
  "product_type": "nextjs_auth_app",
  "product_promise_present": true,
  "commands_detected": [
    "node -e \"const fs=require('fs'); const pkg=JSON.parse(fs.readFileSync('package.json','utf8')); if(!pkg.scripts || !pkg.scripts.build || !fs.existsSync('app') || !fs.existsSync('auth.ts')) process.exit(1)\""
  ],
  "command_results": [
    {
      "cmd": "node -e \"const fs=require('fs'); const pkg=JSON.parse(fs.readFileSync('package.json','utf8')); if(!pkg.scripts || !pkg.scripts.build || !fs.existsSync('app') || !fs.existsSync('auth.ts')) process.exit(1)\"",
      "exit_code": 0,
      "seconds": 0.13,
      "stdout": "",
      "stderr": ""
    }
  ],
  "secret_candidates": [],
  "blocking_secret_candidates": [],
  "fake_completion_candidates": [
    {
      "file": "app\\client-example\\page.tsx",
      "line": 8,
      "pattern": "\\bTODO\\b"
    },
    {
      "file": "components\\client-example.tsx",
      "line": 21,
      "pattern": "placeholder"
    },
    {
      "file": "components\\ui\\input.tsx",
      "line": 14,
      "pattern": "placeholder"
    }
  ],
  "blocking_fake_completion_candidates": [
    {
      "file": "app\\client-example\\page.tsx",
      "line": 8,
      "pattern": "\\bTODO\\b"
    },
    {
      "file": "components\\client-example.tsx",
      "line": 21,
      "pattern": "placeholder"
    },
    {
      "file": "components\\ui\\input.tsx",
      "line": 14,
      "pattern": "placeholder"
    }
  ],
  "proof": {
    "runtime": [],
    "visual": [],
    "ci": [],
    "independent_review": []
  },
  "rejected_proof": {
    "runtime": [],
    "visual": [],
    "ci": [],
    "independent_review": []
  },
  "rejected_proof_details": {
    "runtime": [],
    "visual": [],
    "ci": [],
    "independent_review": []
  },
  "scan_stats": {
    "secret_priority_count": 0,
    "fake_priority_count": 3
  },
  "evidence_levels": [
    "L1_STATIC",
    "L2_DETERMINISTIC"
  ],
  "score": 74,
  "score_caps": [
    {
      "max_score": 89,
      "reason": "Runtime proof missing for critical flows."
    },
    {
      "max_score": 74,
      "reason": "UI project missing visual proof."
    },
    {
      "max_score": 89,
      "reason": "High-stakes release missing independent review."
    }
  ],
  "p0": [],
  "p1": [],
  "verdict": "ALMOST READY",
  "not_verified": [
    "runtime proof",
    "visual proof",
    "independent review"
  ]
}